,0,1,2,3,4,5,6,7,8,9,10,11,12,13,14,15,16,17,18,19,20,21,22,23,24,25,26,27,28,29,30,31,32,33,34,35
SH대치1단지,환경좋고 돈만되면평생살고싶네요,살기 너무 좋습니다.,나쁘지 않아요 ㅇㅇㅇㅇ,조오오오오오오오타타,ㅇ!,너무 좋아요. 환경좋아요.,서울이하서 너ㅜ 좋아여,굳굳,아쥬아쥬아쥬아쥬아쥬아조하,굿굿굿,굳굳굳굳굳굳굳귿굳굳,깔끔하고 조용함. 마음애들었음,살기좋은곳입니다! 적극추천,입지 최고입니다.  더할나이 없음,최고지요 입지최고 머든지최고,가나다라마바사아자차카?,.마이네미즈안지용,.마이네미즈안지용,흠 뭐라하기가.....,여기 좋은가요.....?,여기는 영구임대아파트에요^^;;,,,,,,,,,,,,,,,
개포래미안포레스트,주민들이 구룡역을 이용하지 않눈 이유가 있는지요 ?,주변 병원이나 마트 등 인프라가 잘 구성 되어있나요?,전철역빼고는 불편없음,구룡초역 확정으로 겜끝,구룡역으로 확정됐는데....,지하철역이 좀 아쉬워요,말해뭐합니까 입만아프죠,"입주 10여일 전 입니다,",입주예정인데 기대됩니다,동네학군아시죠? 생활권역아시죠? 말해머해요ㅎㅎ그냥 자고있어도 돈소리가들려요,좋아요 하하 넘나요,지하철역이 멀어서 아쉽지만 대중교통 외에는 살기에는  더없이 좋음.,지하철역은 좀 아쉽긴 한데.. 그래도 근처에 숲이 있어서 친환경적인 아파트에요!,주변에 달터공원과 양재천이 있어서 저녁에 산책하기 딱 좋을것같아요!,개포래미안포레스트!!! 이름에서도 숲이!! 지하철이 아쉽지만 건강하게 살기에 좋은 친환경 아파트가 될것 같아요!!!,115동 입주예정자입니다. 입주가 기대 되는 곳입니다.,내년에 드디어 입주을 앞두고 있어요.  그냥 무조건 좋아요. .ㅎㅎ,,,,,,,,,,,,,,,,,,,
개포자이,좋아요 정말 살기 좋은거 같아요,,,,,,,,,,,,,,,,,,,,,,,,,,,,,,,,,,,
개포자이프레지던스,부동산 투자 참 힘듭니다.금리인상으로 아파트 구입 이후 생활이 걱정 되기도 합니다.지금은 부동산 보다는 다른 재테크 투자에 눈을 돌려야 하는 시기같은데아래쪽 자료가 괜찮네요.https://me2.do/GSUCh8jM,부동산 투자 참 힘듭니다.금리인상으로 아파트 구입 이후 생활이 걱정 되기도 합니다.지금은 부동산 보다는 다른 재테크 투자에 눈을 돌려야 하는 시기같은데아래쪽 자료가 괜찮네요.https://me2.do/GSUCh8jM,부동산 투자 참 힘듭니다.금리인상으로 아파트 구입 이후 생활이 걱정 되기도 합니다.지금은 부동산 보다는 다른 재테크 투자에 눈을 돌려야 하는 시기같은데아래쪽 자료가 괜찮네요.https://me2.do/GSUCh8jM,현재 세입자 못구해서 난리도 아니네요.올해 2월초?중순경 입주 임박하여79m² (24평형) 기준 전세가 6억이하로 호가 형성됩니다.수요자분들은 느긋히 5억 후반에 입주가능,지금 시세가 8-9억대인데…,"부동산도 주식도 코인도 참 대응하기 어렵네요. 좋은 위치이고 좋은 아파트인데 늘 가격이 문제인듯 싶네요. 내가 사면 하락 할 것 같고,내가 안사면 더 오를 것 같고,어차피 장기거주라면 큰 의미가 없지만, 월급쟁이로 아파트하나 마련하는 일이 너무 힘겹네요. https://blog.naver.com/myungastock",,,,,,,,,,,,,,,,,,,,,,,,,,,,,,
개포주공5단지,개포주공5단지 4년째 거주중.  주차를 빼면 정말 살기 괜찮은 곳입니다. 물론 구축의 한계는  있지만 시장도 가깝고 편의시설도 많고 지하철도 가깝고 다  괜찮네요,전세만기가됐는데  집주인이 돌려줄돈도없고  시세보다 올려내놓아서 나가지도않아서  재계약하고  보험듭니다. 재건축아파트라 전세떨어질수도있는데  돈없는집주인이라 돌려받지도못해요.  집값올랐다고  자랑하면서 전세금돌려줄돈은없데요.,"대략적인 장단점은 언급되었으니, 제 개인적인 만족포인트를 말씀드리면.. 베란다와 복도에서 보이는 뷰가 정말 아름답고  안정감을 느낍니다. 남쪽으로는 대모산과  개포신축아파트들의 야경, 서쪽으로 경기여고뷰,  북쪽으로는 양재천수목들과 대치동쪽 아파트뷰.",학군좋고 산책길도 있어서 좋고 아파트 단지 조용하니 살기 좋음 ^^,아파트 오래 된 거에 비해 관리 깨끗하게 잘함 학군도 우수하고 교통편리도 좋음,우선 아파트 단지내 조용합니다. 양재천 산책하기 좋구요 개포동역도 엄청 가까워요.강남역까지 가는 버스도 있구 30분도 안걸려요아파트가 좀 낡고 주차공간이 적은데 이거 빼고는 솔직히 살기 좋은 동네인것같아요,"양재천 가깝고 지하철, 버스 바로 앞에 있어서 좋음주차공간이 적은게 아쉬움",교통도 좋고 조용하고 다 너무너무 좋은데 주차공간이 적은게 제일 아쉽네여 ㅜㅜ,단지가 조용하고 상가 학교 근처라서 좋습니다 ~ 주차도 다른 단지보다는 수월해요,좀 낡은거 빼고는 교통 좋고 조용해서 좋음,지하철 가깝고 양재천 가깝고 분당선 역세권이고 조용하고 버스 노선도 다양하고 살기 좋은 동네임,주차공간이 부족해서 주차할때마다 스트레스 받음 ㅠㅠㅠㅠㅠ,"역에서도 가깝고 학군도 좋음, 주변 조용해서 살기 좋음, 단지 내 상가 있어서 편함","교통 좋고 학군 좋고, 양재천있어서 산책하기에도 좋아요 ~ 주거지로는 딱인듯!","지하철역, 시장, 상가, 양재천, 학교 등 근접해서 좋음",교통 편리하구요 시장도 가까워서 좋아요 ^^ 주변도 조용하고 양재천이 있어서 좋아요 ~*^^*,"장점 - 지하철역에서 가까움, 조용하니 살기 좋음단점 - 주차가 불편함 , 집이 좀 낡았음",집이 좀 낡긴 했는데 교통 좋고 조용하니 살기에는 좋네요 ~,지하철 가깝고 단지내 조용해서 애들이랑 살기에 좋음,주차가 좀 불편해요 ㅠㅠ 아파트 단지는 조용하고 좋아요,상가가 바로 앞에 있어서 편리하고 지하철 역도 가까워서 출퇴근하기에 좋네요 ^^,깨끗하고 살기 좋은 동네고 앞에 양재천이 있어 산책하기 좋아요,개포그랑자이 디에이치아너힐스 들어오면 상가들 주위 인프라구축 확실히 되겠네요~~~,,,,,,,,,,,,,
개포주공6단지,"개포주공6단지에 2004년부터 2022년 2월까지 거주했었습니다.단점 2개(주차, 오래된 아파트)만 극복하면 정말 살기 좋은 곳이라고 생각해요.장점1. 학군: 바로 앞에 초등학교, 중학교 있고 고등학교는 숙명여고, 경기여고, 중동고, 중산고, 휘문고, 중대부고, 개포고, 진선여고 등으로 갈 수 있습니다. 학원은 대체로 대치동으로 다닙니다.장점2. 양재천: 다른 곳으로 이사가기 전에는 몰랐어요. 밤에 여자 혼자 걸어도 안전한 산책로가 가깝다는거 정말정말 큰 메리트에요.장점3. 대중교통: 개포동역과 대모산입구역 사이에 위치해있어요. 대치역, 양재역, 강남역, 광화문 가는 402번 버스가 거의 5분에 한대씩 옵니다. 개포동역 쪽으로 가면 대치역, 강남역쪽 가는 버스가 2대나 더 있습니다. 대모산 입구역 쪽으로 가면 삼성역으로 바로 가는 버스도 많아요. 경기도로 이사가니까 이 대중교통이 너무 아쉽네요.전 이곳이 거의 고향같아서 가능만 하다면 다시 개포동 들어가고 싶은 마음이 굴뚝같습니다!!","전세가가 부담스럽지 않아서, 애들 교육때문에 이사왔는데.. 학원가 이용은 용이한데...살기에는...주차등..조금 힘드네요.","양재천 있어 산책하기 좋고, 남향이라 햇빛 잘 들고 분당선 있어 교통도 좋아요.",9억하던게  30억이네 ㅋㅋ반토막 나긋네~,"개포동역과 대모산입구역 지하철이 있어 출퇴근이  편하네요,",,,,,,,,,,,,,,,,,,,,,,,,,,,,,,,
개포주공7단지,강남 출퇴근하시는 분들 추천이요다만 차끌고 다니는 사람들은 불편할듯요주차장이 완전 헬임 ㅠㅠ,"양재천, 교통, 학군 정말 다 좋은데 주차가 넘 힘드러여 ㅠ",교통편리합니다. 지하철 가깝고 버스도 자주옵니다. 편의시설이 주변에 있어서 좋아요,"단지가 조용하고 깨끗하구요 버스, 지하철 다 편리하게 이용 가능합니다.",연식이 오래된 아파트인것 빼고는 나무랄데가 없어요지하철이 바로 앞이라서 교통편 완전 최고에요 !!,학교가 근접해있어서 좋구요 공기 맑고 주변환경 좋습니다.,대모산이랑 가깝고 양재천이 있어서 쾌적합니다. 지하철역과 버스도 가까이 있어서 교통문제는 없습니다.,학군 좋고 교통도 너무 편리합니다. 주차가 헬인것 빼고는 좋아요,공기도 맑고 환경이 좋아요 주차가 좀 힘든게 문제네요 ㅜㅜ 다른거는 너무 좋은데 주차문제만 좀 해결됐으면 좋겠네요 ..,역이 가까워서 좋은데 좀 시끄러운게 있어요 ㅜ,초등학교 중학교가 근접해있어서 도보로 다 이용 가능하구요 학원 보내기도 편하고 지하철도 가까워요,"교토 좋음, 주차는 별로 안좋음,",교통편이 편리해요! 지하철 바로 앞이라서 출퇴근하기에 좋구요~ 주변에 학교들도 많아서 자녀들 있는 분이라면 좋아할것같네요 ㅎㅎ,주차장빼고 다 좋아요,거의 40년이 이제 다 되어가니...복도식에 엘리베이터에 사는데 불펴하지만 여러 호재가 있어서 몸빵중입니다!!,,,,,,,,,,,,,,,,,,,,,
개포현대(200동),,,,,,,,,,,,,,,,,,,,,,,,,,,,,,,,,,,,
개포현대2차(220동),,,,,,,,,,,,,,,,,,,,,,,,,,,,,,,,,,,,
경남,"부동산도 주식도 코인도 참 대응하기 어렵네요. 좋은 위치이고 좋은 아파트인데 늘 가격이 문제인듯 싶네요. 내가 사면 하락 할 것 같고,내가 안사면 더 오를 것 같고,어차피 장기거주라면 큰 의미가 없지만, 월급쟁이로 아파트하나 마련하는 일이 너무 힘겹네요. https://blog.naver.com/myungastock",조경 이쁘고 관리 잘 된 실거주하며 재건축 기다리기에 좋은 아파트임. 학교와 학원 가까운 것도 장점! 양재천 조망에 멋진 산책로가 지척에 있어서도 매우 쾌적하고 좋음,"학교 가깝고 대치동 학원가도 그리 멀지 않으며 버스로 이용하기에도 정문,후문에 버스 정류장 가까이 있어 살기에 좋습니다.주변이 조용하고 조경도 이쁘고 양재천도 바로 코 앞에 있어 만족하며 살고 있습니다","양재천을 횡단보도 안건너고 바로 갈 수있는게 큰 장점인 것  같아요. 바로 근처에 홈플러스도 있고, gs25도 있어서 너무  편리하고요. 다만 지하철이 조금 먼게 단점인데 바로 앞에 도곡역과 매봉역을 갈수있는 버스가 각각 있어서,  딱히 불편 하진 않아요. 거의 10년째 사는 중인데 만족합니다",아름다운 동네. 살기좋은 아파트입니다.,최고의 거주지,학군이 좋고 주변의 편의시설이 많아요~ 그리고 학원가가 가깝게 있어 아이 교육환경으로 정말 좋습니다^^대체로 조용하고 편한 분위기에요^^,연식이 오래되어도 관리가 정말 잘되어있어서 그런지 큰 불편함은 없어요.. 주차시설은 좀 불편합니다ㅠㅠ그리고 지하철역도 가까운건 아니에요..,양재천을 길건너지 않고 바로 갈수있는게 정말 큰 장점이고 단지가 조용하고 유흥시설이 없어 아이들 키우기 정말 좋아요~!,주차공간은 조금 부족하지만 단지가 조용하니 좋아요ㅎㅎ지하철역은 조금 멀지만 버스 이용하기가 편해요!,연식이 오래된 아파트지만 관리도 잘 되어있고 양재천이 근처에 있어 산책하러 다니기 정말 좋은곳이에요 ㅎㅎ,,,,,,,,,,,,,,,,,,,,,,,,,
대청,여기 근처가 좋아보여서 알아보는중인데요. 용적률이 왜 1000프로가 넘나요??,대중교통이 너무 잘되있지맞 주차하기 힘들어요  대치2단지보다는 여러모로 살기 좋아요,위치는좋으나 주차가 ㅎㅇ,"장점 - 지하철 가까움, 근처 공원과 학교 근접해있음 , 단지내 조용하고 깨끗함단점 - 주차난, 아파트가 많이 낡아 불편함이 좀있음",층간소음 있구요 아파트가 오래되다보니 곰팡이도 피고 ㅜㅜ 주차장도 헬이에요 ........지하철 가까운건 좋네요 ...,쥐는 안 나올까요..?,곰팡이는 관리 잘못입니다 환기 잘시켜야되요,조용하고 지하철 가까워서 출퇴근하기 좋습니다.,초등학교 가까이 있고 지하철도 가깝고 살기 좋아요 ~,대중교통이 너무 잘되있고 차로 이동하기에도 너무 좋습니다.다만 주차하기 힘들고 아파트가 좀 낡아 불편함을 감수해야합니다.,일단 지하철 가깝고 공원도 가깝고 양재천도 가까워요단지내 조용하고 관리를 잘해서 깨끗하네요주차만 좀 해결되면 좋을것같아요,주차장이 너무너무 열악해요 ㅠㅠ 매일 주차전쟁 ..........  지하철이용하는게 가장 좋을듯요 ...,"초초역세권!! 양재천, 대진공원 바로 앞 !공기 좋고 깨끗하고 조용하니 살기 좋음 굿",가격이 높은게 제일 흠이네요 . 아파트도 많이 낡았던데 ...,이정도인데 새 아파트 되면 날라가겠지요? 위치가 좋습니다,아파트가 많이 낡긴했지만 단지 조용하고 깨끗해요 ~ 주변에 공원도 있어서 아이들과 산책하기 좋네요 ㅎㅎ,"지하철 바로앞, 공원도 가깝고 양재천도 인접 . 아주 굿굿",전세가가 싸서 이사오긴 했는데 저희집은 곰팡이가 너무 심해서 닦아도 닦아도 해결이 안되네요....주차지옥이라고 듣긴했지만 이정도일줄...,주차지옥은 주변 주공 가보시면 보실수 있어요. 비하면 약과입니다,여기가 젤 심하다 생각했는데 잠실 장미오니 거긴 애교수준이네요...ㅎㅎㅎ,,,,,,,,,,,,,,,,
대치2단지,갑자기 늘어난 거래수와 계약취소건수들을 볼때 실거래가 띄우기 작업 들어온거 같음https://youtu.be/SI5D1OMR5XE,"위치가 너무 좋고 주변 산책하기에도 너무 좋아요.
그런데 주차가 많이 불편해요.",재건축파가 아니라 리모델링단순 반대하는 노인들 모임이  있습니다. 그냥 이사 가기 싫은 할아버지할머니들 소수  모임입니다.,주차지옥인거 빼면 살만합니다. 중동중은 배정  힘들고 개원중 배정됩니다. 주변에 휘문 중동 자사고  가까워서 자사고 동선은 좋습니다 단지 조용하고  단지와 양재천이 접경이라 양재천 접근성 습니다  단지 중간중간 양재천 진입로 있습니다. 대청역  대모산입구역 두역다 가까운 편이고 학여울역은  도보가능하지만 지금은 의미 없구요 단지는  조용합니다,"옆에 lh1단지와 같은 임대아파트 같이 가서 학군이 좀  아쉬워요.  리모델링을 추진하고 있지만 일부 재건축파들과 의견충돌이  있어 10년째 제자리 걸음입니다.  학령기 학부모님들은 투자로 들어오실때 신중하셔야 합니다.  제가 여기 2016년까지 살았는데 가격도 너무 많이 올랐네요.  그래도 평수가작아서.,신혼살기는 나쁘지 않습니다,.",주변에 공원이 많아서 넘 살기 좋음 양재천 대진공원 마루공원 더블 역세권에 마을버스 10 분이면 삼성역이라 교통도 매우 편리함 주차가 힘들긴 한데 못할 정도는 아님.. 강남으로 들어오고 싶은 분들께 추천. 리모델링은 시간이 필요하나 되기만 하면 정말 만족스러울듯. 팔고 싶지 않은 집.,리모델링 얘기 나온지가 언젠데 아직도 재건축 주장하는 분들이 많습니다. 녹물에 주차장 이중주차하면서 실거주 버티고 있는 중인데 제발 뜻을 모아 리모델링 했으면 합니다.재건축은 세대수가 많아 사업성이 안나옵니다. 리모델링이 살길입니다. 7년내에는 꼭 새아파트 입주 하고 싶어요.,"입지가 ㅎㄷㄷ 주차난 감안하고 들어와서 그런지.. 큰 불평없음  주변환경 (양재천,공원 등) 대만족ㅎㅎ",쥐는 안나오나요..?? 양재천 가까워서 쥐 나올까봐 걱정 돼서요ㅠ,양재천 산책이 큰장점 그리고 3호선 분당선 모두 도보 5~10분거리에  있어 편하고 삼성역까지도 버스로 15분정도  다만 1단지가 임대아파트이고 주차공간이 좁아  불편합니다,양재천 산책이 큰장점 그리고 3호선 분당선 모두 도보 5~10분거리에  있어 편하고 삼성역까지도 버스로 15분정도  다만 1단지가 임대아파트이고 주차공간이 좁아  불편합니다,장점은 대중교통 이용하기가 편리하고 학원가도 가깝고 학군도 좋아서 아이들 교육환경으로는 정말 좋은 위치에요. 뒤에 양재천도 있어서 밤에 산책나가기도 좋습니다.단점은 층간소음과 주차가 가장 큰 단점입니다.. 그 외에는 오래된 아파트인거 치고는 관리가 꽤 잘되어있는 편이에요.,더블역세권이라서 지하철 이용하기가 진짜 편해요ㅎㅎ 게다가 양재천도 가깝구요~!,학군이나 교통면에서는 이만한 곳 찾기 힘들것같네요.. 주차나 층간소음같은 경우는 오래된 아파트라 어쩔수없는것 같지만요ㅜㅜ..,주차가 조금 불편하긴 한데.. 그래도 앞에 상가도 있고 교통도 좋아서 괜찮아요^^,리모델링만 된다면 입지나 학군같은 문제는 어디서도 뒤쳐지지않으니 최고의 아파트가 될 수 있을듯.,입지나 학군 교통 모두 좋으나 밤에 집에 들어오면 주차할 공간을 찾기가 어려운게 단점이긴 하네요..,집 평수는 작지만 입지가 워낙 좋아서 크게 불편하진 않아요~! 밤에 양재천 산책할때가 제일 행복해요 ㅎㅎ,교통시설이 진짜 좋아요ㅜㅜ 분당선과 3호선 전부 이용가능하고 마을버스만 타면 코엑스 한번에 갑니다~,이곳의 가장 큰 장점은 교통이 편리하고 근처에 삼성의료원과 우체국이 있어요! 게다가 근처에 양재천과 공원이 있어서 산책하기도 너무 좋아요~대신 단점은 아무래도 전월세 이용이 많아서 인테리어 수리가 잦은 편이라 소음이 있고 주차하기에 불편합니다..,아무래도 오래되었다보니 층간소음은 좀 심한편입니다ㅠㅠ하지만 근처에 나무도 많고 공원도 많아서 요즘같이 미세먼지 심할때는 미세먼지 제거에 도움이 되죠ㅎㅎ,근처에 마트가 많아서 장보기에 편리합니다~^^주차하기 어려운것만 제외하면 근처에 양재천도 있고 너무 좋아요~!,단지 바로 뒤가 양재천이라 밤에 걸으면 기분이 너무 좋아요 그리고 삼성역도 가까운 편이라 놀러 나가기에 좋습니다~ 대청역이랑 학여울역도 가깝고요! 교통편은 정말 좋은곳이에요 ㅎㅎ,대치동 학원가가 가깝고 더블역세권이라 아이 키우기엔 입지가 참 좋지만 집이 좀 좁아요..ㅜㅜ,외부에서 보면 오래된 아파트라고 하기엔 믿기지 않을만큼 깔끔하게 잘 해놨는데 내부 구조는 조금 수리가 필요해보여요..ㅜ 그리고 주차공간 문제만 빼면 살기에 불편한 점은 전혀 없어요~!,학군도 입지도 너무너무 ?지만 주차환경이 개선되어야 한다고 생각해요ㅜ,3인가족 이상이 살기에는 좀 좁은감이 있어요ㅜㅜ 그 외에는 더블역세권이라 위치좋고 양재천이 가까워서 환경이 정말 좋습니다!,관리비도 저렴한 편이고 주변에 우체국이나 경찰서 등 관공서들이 있어서 볼일보기에 편리해요~~! 주차공간이 부족한 편이긴 하지만 인근에 거주자우선주차공간 있어요!,지하철 두곳이 가까워서 대중교통 이용하기에 너무 편해요~ 대신 주차공간이 부족한 편입니다ㅜㅜ,주차난이 너무 심합니다. 그러나 대중교통은 잘 되어있어서 만족하는 편이고요. 조용하고 주위에 산책로가 있어서 주거지로서는 좋아요~,삼성역까지 가깝지만 가깝지 않은 거리에 있고 양채천을 산책하기 좋아요. 입지가 정말 좋은 단지입니다.,이웃의 까치마을 아파트 오름세라네요.,,,,
더샵트리에,,,,,,,,,,,,,,,,,,,,,,,,,,,,,,,,,,,,
디에이치아너힐즈,강남에 속해 있으면서도 주거지로써 환경이 좋아요. 시끌시끌하지 않고 대치동도 바로 근처고 만족해요.커뮤니티도 좋아요. 층간소음도 아파트치고 나름 잘 방어한거 같아요.,"커뮤니티 안에 키즈카페랑 수영장 있어서 애기들 놀리기 좋고  어린이집 단지안에 있어 아이키우기 편해요. 전망대 카페  예쁩니다. 도보권에 개포시장과 개포도서관 양재천 있고 20분만  투자하면  대치동도 갈 수 있어요. 단지내 마트가 없는게 아쉽지만 상가 편의점에서 간단한건  살수있고 요즘에는 다들 배송시키니 큰 불편은 없어요.  보안 잘 되어있고 커뮤니티 북카페, 전망대, 수영장, 프로그램  기타등등 잘 짜여있어서 단지밖으로 나갈일이 크게 없어요.",커뮤니티시설과 학군이 궁금하군요?,신흥부촌이  되겠네요~ 부럽습니다!! 이제 곧 입주네요!!! 전세라도 갈까?!!고민 중입니다!!,입주도 얼마 남지 않았네요.  여기도 입주민들이 계시네요,디에이치 아너힐즈 입주자 커뮤니티 네이버 카페https://cafe.naver.com/gaepo3apt전 네이버에서 찾아서 가입했어요. 반가워요.^^,입주자 카페 찾고 있었는데 감사합니다!! 주민이신가요?^^ 반갑습니다.,입주자 카페가 있다고 하던데  어디에서 찾아야 되나요?,,,,,,,,,,,,,,,,,,,,,,,,,,,,
디에이치퍼스티어아이파크,,,,,,,,,,,,,,,,,,,,,,,,,,,,,,,,,,,,
